Page ID,Page name,Disclaimer,Amount spent (HNL),Number of ads in Library
268438269939620,Nasry Tito Asfura,Partido Nacional de Honduras,2306505,167
1392592317738074,Jorge Cálix,Jorge Cálix,1538118,1008
124300620957187,Juan Orlando Hernández,Juan Orlando Hernández,1015079,256
158867210812129,Partido Nacional de Honduras,Partido Nacional de Honduras,985662,51
299920016701445,Xiomara Castro De Zelaya,Partido Libertad y Refundación (LIBRE),677017,47
703368406666619,Vox Populi HN,Vox Populi HN,655246,154
124300620957187,Juan Orlando Hernández,Presidencia de la República de Honduras,626299,117
283473761746124,David Chávez,Partido Nacional de Honduras,605172,110
221798457888029,World Vision Honduras,ASOCIACION VISION MUNDIAL HONDURAS,510276,199
980311812004557,Armando Calidonio,Armando Calidonio,504301,145
850142798711511,Ebal Díaz,Ebal Jair Diaz Lupian,384169,1106
633761396813612,Erasmo J. Portillo,Erasmo José Portillo Pinto,358969,56
114601521910,Jorge Aldana,Jorge  Aldana,281875,148
486382251906084,Honduras El País,Diario El  Pais.hn,236814,1922
349524351841734,Cárlenton Dávila,Jose Carlenton Davila Mondragon,213716,47
113279288457664,Quintin AMIGO,Quintin AMIGO,187627,131
421574011322217,Alcaldía del Distrito Central,Alcaldía del Distrito Central,166501,105
180779708635647,Juan Diego Zelaya,Juan Diego Zelaya,159493,236
670215973147907,Osman Aguilar,Osman Danilo Aguilar Ponce,155318,62
431679393649161,Escuela de Enfermería CAE,Escuela de Enfermería CAE,154811,126
104846908122173,Alia Kafati Diputada,Alia Niño Kafaty,152765,247
103731561814112,Partido Salvador de Honduras,Partido Salvador de Honduras,152741,55
1536298963332674,Eduardo Martell,Eduardo Martell,149831,106
299920016701445,Xiomara Castro De Zelaya,These ads ran without a disclaimer,139526,12
112724021787834,Por Nuestros Hijos,Con Mis Hijos No Te Metas HN,136172,136
459107311130639,Dr. Luther Harry,Dr. Luther Harry,130640,173
112772801190681,Newsflixx,These ads ran without a disclaimer,123780,12
349524351841734,Cárlenton Dávila,Cárlenton Dávila,120076,27
496839213786593,"Secretaría Nacional de Ciencia, Tecnología e Innovación","Secretaría Nacional de Ciencia, Tecnología e Innovación",118669,338
151154174943498,UNICEF Honduras,These ads ran without a disclaimer,104369,2
167878593236712,UNICEF en español,UNICEF con créditos publicitarios de Facebook,103056,256
1073562932669661,Romeo Vásquez Velásquez,Jesús Alberto Vásquez Zelaya,95146,39
486411318128334,Estamos Listos Honduras,Presidencia de la República de Honduras,94087,60
481781965172466,Aquafinca St Peter Fish,Aquafinca St Peter Fish,69145,15
148653345178694,Casa Presidencial de Honduras,Secretaría de Coordinación General del Gobierno de Honduras,69057,10
121707964354727,MiNota HN,MiNota HN,63461,109
249600751823745,Toñito Alcalde SPS,Luis Irwin Leiva Berrios,59817,27
288499014527710,Rasel Tome,Rasel Antonio Tome Flores,57608,44
153003381515332,Cespad - Centro de Estudio para la Democracia,Centro de Estudio para la Democracia (Cespad),56352,113
491553204198958,Revistazo.com,Revistazo.com,55896,125
275244985920774,Antonio Rivera,Antonio Rivera,50562,13
112241373658441,Fernando Gradiz,Fernando Jose Gradiz Benitez,50217,30
140032892460,Embajada de Estados Unidos en Tegucigalpa,These ads ran without a disclaimer,49520,3
338449830056765,Gustavo Romero / Candidato a Diputado por Cortés,Gustavo Adolfo Romero Romero,48831,54
110319032996453,Luis Ortega,Luis Ortega Sanchez,45904,101
213460505776904,Marvin Vásquez Diputado FM Casilla 72,Marvin Reniery Vásquez Teruel,45659,264
107278870906936,GeoMapps Honduras,Geomapps,43811,31
104599735671754,Goberna Honduras,Goberna Honduras,42221,111
1604501296475641,Godofredo Fajardo / Amemos A Nuestra Capital,Godofredo Fajardo Ramirez,41782,48
187581588077191,Juan Barahona,Andres Alfredo Castro Turcios,41250,64
567630230341046,Arturo Alonzo,Felix Arturo Alonzo Matute,40666,57
102923742103397,Cárlenton Dávila,Jose Carlenton Davila Mondragon,39788,33
110168511474333,Distrito News,Distrito News,39058,62
2180582345316242,Secretaría de Desarrollo Social,Secretaria de Estado en el Despacho de Desarrollo Social,37890,19
107565870853089,Samuel Garcia,Carlos Armando Garcia Rosales,36826,45
153003381515332,Cespad - Centro de Estudio para la Democracia,Centro de Estudio para la Democracia,36100,46
342580622273021,ElBunker504,ElBunker504,36008,21
100616299413033,Soy Chano Rivera,Soy Chano Rivera,35658,20
856012741442139,Ipas LAC,Astrid Leticia Aguilar Pinell,35628,26
483441215141189,ASJ Honduras,Asociación para una Sociedad más Justa,34731,37
109956938157318,Hechos Amanecer,Hechos Amanecer,34458,55
107048651784681,Radio Post,Radio Post,34309,41
138816232821931,PNUD en Honduras,PNUD (Programa de las Naciones Unidas  para el Desarrollo),34107,26
368991889627793,Carlos Urbizo Solis,Urbizo Presidente,33959,32
1754727451480916,Maribel Espinoza,Adela Zelaya Zavala,33767,41
112333800693678,Hugo Noé Pino,Daniel Andres Casula Salinas,33245,14
227061690777961,Televicentro HN,Compañía Televisora S.A.,33194,17
317590938686910,Oscar Cruz Diputado Suplente,Oscar  Bryan Cruz Almendarez,32496,61
114601521910,Jorge Aldana,Jorge Aldana,32401,18
100613059041228,"Gustavo Flores, Alcalde SPS, Casilla #1",Acción Transformadora,32351,147
1619479898324505,Partido Liberal de Honduras,Partido Liberal de Honduras,32345,48
106295494634992,Adeliano Amaya,Hillary Nicole Wong Espinal,32051,19
146555345521043,Cohep-Oficial,Cohep-Oficial,31389,14
1591865517769660,Fundación Kafie,Fundación Kafie,30531,14
214773008865018,Commission Encounter,These ads ran without a disclaimer,29286,1
112529930493702,Democracia en Acción Hn,Voto Informado Honduras,28416,72
106091181352547,Wilmer Rosa,Sergio Murillo,28313,104
643513979193133,Justicia para Beatriz,Neuma,28182,84
973656702704928,ParadigmaEncuestadora,ParadigmaEncuestadora,28103,18
1314458455242369,German Altamirano,Nixon Rufino Castro Cano,27574,18
112226484592571,Diario Post,Diario Post,26635,59
114459775060114,José  Flores,José  Flores,25716,4
703368406666619,Vox Populi HN,Vox Populi HN,25290,4
699137286926774,TuEncarguito.Net,Turcios Calix Herson Bladimir,25079,8
102290165456407,Honduras - Vacúnate a Tiempo,These ads ran without a disclaimer,24127,4
1270501863014285,Dr. Walter Perdomo,Walter Perdomo,22380,48
107157760890864,Congreso Primero,Congreso Primero,21592,4
749945128395059,AHIBA,Asociación Hondureña de Instituciones Bancarias,21040,8
1619479898324505,Partido Liberal de Honduras,Partido Liberal Honduras,20634,6
211956622005019,PSH DC,PSH DC,20497,20
100616299413033,Soy Chano Rivera,Mario Enrique Rivera Callejas,20490,12
213736845319886,Carlos Eduardo Reina,Carlos Reina,20262,3
103911988776961,Denis Villalta,Denis Ricardo- Villalta Rivera,20000,4
106586564537122,Pedro Chávez,MARÍA AUXILIADORA AGUILERA GRANERA,19656,18
222259464464471,Yani Rosenthal,Partido Liberal de Honduras,19598,7
143139052987353,Alia Kafati Hay Salida,Alia Niño Kafaty,19384,28
1402511926712969,Mauricio Cálix,Mauricio Calix Ceballos,19359,10
101444895066418,Juventud Demócrata Cristiana HN,Vivian Estefane Rodriguez Moncada,19157,23
869306953200646,Fabiola Abudoj,Fabiola Claudett Abudoj Mena,18944,24
109305628397892,Mario A Gonzales,Mario A Gonzales,18749,27
221798457888029,World Vision Honduras,World Vision Honduras,18715,6
103112105105138,Juan Carlos Lagos - Diputado por Copán,Juan Carlos Lagos Fuentes,18666,27
187581588077191,Juan Barahona,Darwin Enrique Barahona Najera,18215,10
21935701184,DIARIO EL HERALDO,DIARIO EL HERALDO,18166,21
111283084551923,Allan Macoto Diputado,Mario Merardo Zaldaña Olmedo,17877,47
670215973147907,Osman Aguilar,Osman Aguilar,17819,9
130202453827085,Asociación Calidad de Vida,Asociación Calidad de Vida,17649,22
416964031695578,Diputada Scherly Arriaga,Scherly Arriaga,17513,38
1314458455242369,German Altamirano,German Altamirano,17474,69
109774781441351,Francisco Moran - Diputado Fco. Morazán,Jorge Geovanny Reyes Espinoza,17194,32
101779245131396,Maria Antonieta Mejia,Waleskita Mejia,17073,6
103978381957546,Catracho Macizo,Martha Sobeida Soto Lezama,16629,41
110503794626548,"Laboratorio de Gobierno, Innovación y Políticas Públicas",These ads ran without a disclaimer,16609,1
101156194954745,Andres Castro,Andres Alfredo Castro Turcios,16465,39
100750711782346,Christian Martinez Diputado,Christian Josue Martinez Acosta,16276,45
237087153044234,Renan Inestroza,Rossel Renan Inestroza Martinez,16250,20
106862948409248,Unificación Democrática,Lenin Rigoberto Rodas Velasquez,15582,21
1466489633376036,Gilberto Yearwood,Gilberto Jeronimo Yearwood,15563,5
104111364355253,Diario Paradigma,Diario Paradigma,14628,9
107756271125002,Omar Menjivar,Dania Lizbeth Paz Pacheco,14503,18
112333800693678,Hugo Noé Pino,Allan Policarpo Mendez Padilla,14486,18
114301125304932,Secretaría de Trabajo y Seguridad Social,These ads ran without a disclaimer,14478,10
101419972288825,Ernesto Pumpo Diputado casilla #123 cortes,Ernesto Alfonso Pumpo Aguilar,14227,26
21325533991,Inversor Global,These ads ran without a disclaimer,14034,12
112333800693678,Hugo Noé Pino,René Efrain Arias Lopez,13969,15
100345185258583,El Bukele hondureño,El Bukele hondureño,13903,10
114912491193414,Secretaría de Infraestructura y Transporte,Secretaría de Infraestructura y Transporte,13761,27
286652458359644,Mario Suazo,Mario Orlando Suazo Lara,13730,26
110693081275989,La Otra Cara de Latinoamérica,Ana Margarita Lopez Cerrato,13668,28
101704425334880,Erik Javier Tabora,Erik Javier Tabora Tabora,13400,32
268438269939620,Nasry Tito Asfura,These ads ran without a disclaimer,13291,12
109580408013707,Francisco Flores,Francisco Miguel Flores Guifarro,13024,57
28312410177,World Food Programme,These ads ran without a disclaimer,12989,135
109091011430956,Ultra Fighter: Supernova,These ads ran without a disclaimer,12980,14
103459952166807,Nota Pública,Nota Pública,12395,15
100230499051562,Dr. José Jaar Diputado,Salvador Jesús García Aguilar,12376,1
1293887574037684,Harry Panting Diputado,Harry Stephen Panting Zelaya,12238,4
114601521910,Jorge Aldana,These ads ran without a disclaimer,12173,19
107640905023095,Martín Pineda Diputado,Agencia de medios digitales nueve de diez,12129,8
816762251805920,Secretaria de Asuntos Electorales PSH,William Eduardo Carias Ortega,12083,31
582482678625013,Asley  Cruz,Asley  Cruz,12024,37
158158757637896,Alianza Paz y Justicia,Alianza Paz y Justicia,11931,12
100132868614625,Javier Santos,Stephanie Bueso De Santos,11891,6
209099099549632,Luis Rene Suazo,Luis Rene Suazo Peña,11783,5
103403128354133,Guillermo Bográn,Despacho de Guillermo y el Pueblo,11713,14
1511642142221183,Nacionalistas Honestos con Godofredo,Deysi Rosibel Banegas Espinal,11647,15
919092984894463,Partido Salvador de Honduras,Cordelia Ordoñez,11636,5
111168057292933,Universal Noticias,Felecity Celene Cooper Cooper,11573,12
106668254944240,Diputado Leiva,Jacobo Enrique Sanchez Matute,11416,38
496839213786593,"Secretaría Nacional de Ciencia, Tecnología e Innovación",SENACIT,11285,43
103130098432214,El Desmadrado,These ads ran without a disclaimer,11259,11
1519747768323108,Edil Mendez,Edil Mendez,11210,27
108562711599066,Eliseo Vallecillo Alcalde SPS Casilla6,Eliseo Vallecillo Reyes,11093,11
101186198642252,Wendy Guerra Alcaldesa,Erik Javier Tabora Tabora,10757,23
107928668693500,"Quintin ""Amigos""","Quintin ""Amigos""",10706,13
279672622673974,Que alguien me explique,These ads ran without a disclaimer,10641,22
342251765968994,Instituto Hondureño de Turismo,These ads ran without a disclaimer,10582,1
112512804005980,Inversiones B&T,Kizzy Stephany Bermudez Najera,10532,10
127750160666287,Tommy Zambrano Diputado,Cristian Edgardo Moreno Funes,10180,8
209729959619098,Luis Pinel,Luis Pinel,10124,11
100654565363948,Honduras-Nativo,These ads ran without a disclaimer,10046,50
101686915153735,Angela Fernández,Julio Cesar Peña Montoya,9994,24
114082948466158,Mauricio Ramos,Mauricio Ramos,9988,3
101047364836155,Lidia Lopez,Lidia Maria Lopez Amador,9899,18
633761396813612,Erasmo J. Portillo,Erasmo J. Portillo,9895,2
316667995124531,Banco Centroamericano de Integración Económica - BCIE,Banco Centroamericano de Integración Económica,9880,9
850142798711511,Ebal Díaz,These ads ran without a disclaimer,9860,31
58895017663,Banco Interamericano de Desarrollo,These ads ran without a disclaimer,9681,44
103191245342461,Liberales Yoro II,Liberales Yoro,9570,20
108670680800309,Ever Miguel Velasquez,Fernando Navarro Hernandez,9368,4
1265830616816937,Linda Donaire,Linda Frances Donaire Portillo,9237,61
241818544421013,Liliana Guevara Diputada / Yoro,Juan Antonio Discua Castro,9182,34
103187835005303,Ramón Enrique Barrios,Maria Isabel Valdez Briones,9166,11
576932955838386,Iris Pineda,Iris Pineda Ramírez,9077,3
544097135969884,Kritza Pérez,Kritza Jerlin Pérez Gallegos,8850,9
108854322177699,Titanes de la Niñez,Con Mis Hijos No Te Metas HN,8844,22
885680998238121,Melvin Paredes,Hector Manuel Sandoval Rodriguez,8801,15
113279288457664,Quintin AMIGO,These ads ran without a disclaimer,8696,28
102366311693428,Made Pedraza Diputada #151,Madelein Pedraza Budde,8685,27
100983801732465,Arlinton López,Arlinton Lopez,8620,16
104340444603882,Ayudas matres soltera,These ads ran without a disclaimer,8487,2
203029881749479,John Milton García Diputado,John Milton García Diputado,8370,24
213736845319886,Carlos Eduardo Reina,These ads ran without a disclaimer,8272,5
919092984894463,Partido Salvador de Honduras,William Eduardo Carias Ortega,8263,19
1047750315359377,Tato Loucel,Edgardo  Hernan Loucel Aguilera,8232,29
103953654913558,Carolina  Fernandez Trochez,Lourdes Carolina Fernandez Trochez,8210,14
248986568895243,Speechify,These ads ran without a disclaimer,8171,9
110142624101962,Nelson Márquez,Johann Serén Castillo,8170,26
1484915738427517,Iroshka Elvir,Iroshka Lindaly Elvir Nasralla,8109,17
107928668693500,"Quintin ""Amigos""","Quintín ""Amigo""",8073,24
1461365960590351,Antiagingcenterhn,These ads ran without a disclaimer,8045,7
101188568427152,Fardos Nashly Montecinos,These ads ran without a disclaimer,7999,4
105397322360821,Red LGBTIQ+ Chamelecón,Miguel Eduardo Barahona Castro,7876,8
122988594435371,Instituto Forymat,These ads ran without a disclaimer,7870,2
240592082461592,Planilla Rene Bendaña,ICCE,7836,7
104930718595058,Hilmer Hermida,Johana Sarai Ramirez Maldonado,7828,8
582482678625013,Asley  Cruz,Asley Guillermo Cruz Mejia,7779,8
68793499001,UNICEF,UNICEF with Facebook Ad Credits,7705,352
131793653512148,Diario La Prensa,Diario La Prensa,7681,15
104111364355253,Diario Paradigma,Joan Marcelo,7675,16
1392592317738074,Jorge Cálix,These ads ran without a disclaimer,7637,19
699137286926774,TuEncarguito.Net,Fernando Navarro Hernandez,7549,1
101099699702332,Únete al movimiento ciudadano,Únete al movimiento ciudadano,7507,45
110882925332549,Yani Rosenthal,Yani Benjamin Rosenthal Hidalgo,7500,5
100433762843279,Red Solidaria Honduras,Red Solidaria Honduras,7426,5
110307101473418,Jorge G. Reyes,Jorge Geovanny Reyes Espinoza,7422,18
147751821930575,Salud Digital Fundación Carlos Slim,These ads ran without a disclaimer,7326,4
107029964338157,Mario Argeñal,Mario Rafel Argeñal Medina,7299,18
231951286852691,Gilberto Ríos Munguía - Grillo,Gilberto Rios Munguia,7120,11
101226852237939,Centroamérica Post,Martha Sobeida Soto Lezama,7080,6
739334302924225,Ronald Panchame,Luis Alberto Zepeda Argueta,7047,50
106586564537122,Pedro Chávez,María Auxiliadora Aguilera Granera,7035,18
1754727451480916,Maribel Espinoza,Maribel Espinoza,7007,16
107166437591846,Fausto Cálix HN,Fausto Manuel Calix Marquez,7000,21
103366818771274,Ana Karola,Ana Carola Burgos Lopez,6994,4
102200678953147,Wilfredo Lopez Casilla 174,Hector Manuel Sandoval Rodriguez,6900,8
114154619999514,Partido Naranja de Honduras,Raul Peña Moreno,6890,16
709160849247917,Evis Santos,Evis Alexander Santos Tabora,6738,34
607812589389584,Luis Zelaya,These ads ran without a disclaimer,6530,4
118795083320932,Tavo Rodas,Jose Octavio Rodas Mendoza,6510,14
1835111130104087,Victor Barahona,Stevens Barahona,6399,12
1342879305770317,Allan Salazar Diputado,Allan Gerardo Salazar Funes,6274,25
359326941305683,Franklin Avila,Franklin Alonso Avila Carrasco,6133,24
102609935176471,Carla Dip Diputada,Carla Belinda Dip Alvarado,6100,2
101775188874514,Dra Paola Carbajal,Gaby Paola Carbajal Matute,6059,10
113632726761769,Gobierno Honduras,Presidencia de la República de Honduras,6000,3
486411318128334,Estamos Listos Honduras,These ads ran without a disclaimer,5978,24
351987848323268,Visita Sorpresa,Secretaría de Coordinación General del Gobierno de Honduras,5920,2
104756201617166,MP CLEAN HN,These ads ran without a disclaimer,5905,14
339810463063059,Conflict Of Nations : World War 3,These ads ran without a disclaimer,5891,87
103978381957546,Catracho Macizo,These ads ran without a disclaimer,5884,4
881938578596076,Cristianos Valientes,Cristianos Valientes,5803,4
1536298963332674,Eduardo Martell,Vika Yovanka Martell Castro,5647,10
973656702704928,ParadigmaEncuestadora,Fredy Ordoñez Flores,5623,4
348016209601920,Salvador Mata Alcalde,Alexander Martinez,5545,47
415068788604369,David Reyes   Diputado  por Choluteca,David Reyes,5514,16
1716073355341256,La Visión,La Vision,5500,2
102503894494718,Juan Carlos Discua,Jimmy Jhonatan Discua Maldonado,5402,4
1073562932669661,Romeo Vásquez Velásquez,Marvin Reniery Vásquez Teruel,5400,3
107045680721133,La Alianza con el Pueblo,These ads ran without a disclaimer,5347,9
103031135787229,Sensus,Sensus,5333,42
288499014527710,Rasel Tome,Rasel Tome,5232,5
1536298963332674,Eduardo Martell,These ads ran without a disclaimer,5231,22
476494152473046,Secretaría de Desarrollo e Inclusión Social.,These ads ran without a disclaimer,5221,9
129163346947962,Fitness Balancing pillow,These ads ran without a disclaimer,5213,2
1797637890483746,Edwin Guifarro,Alex Manuel Lara Rodriguez,5212,11
1183859241787308,LIBRE Islas de la bahia,El Quinto Poder,5168,5
100654565363948,Honduras-Nativo,Honduras-Nativo,5139,13
104380401971066,Molly Rubi Diputada,Emelda Mollylu Rubi Canizales,5135,20
107928668693500,"Quintin ""Amigos""",Noel Aristeo Molina Funes,5076,32
447476848762504,Fondo Cafetero Nacional,Fondo Cafetero Nacional,5074,7
724521631682438,Honduras News,Honduras News,5061,6
803587436436553,OCDIH,Lilian Guadalupe Gomez Dominguez,5042,12
202788706997599,Whirlpool,These ads ran without a disclaimer,5009,1
269871094826846,Javier Matute - Alcalde,Francisco Javier Matute Romero,4999,5
104724984609378,Laura Enamorado,Laura Enamorado,4983,23
113933318391304,Centro Religioso Amores Eternos,These ads ran without a disclaimer,4836,1
1899303030316889,"Rina Mancía, Casilla 23",Rina Mancía,4834,3
114100139971983,Diputado Alejandro Matute,Eliana Grizeth Salinas Lopez,4830,12
101731461809193,El Periódico de Honduras,Jensy Ninett Reyes Mejia,4799,12
118461631345414,Corporación Noble HN Protección Radiológica,These ads ran without a disclaimer,4775,1
170390491747320,Lenin Turcios - Diputado PINU SD,Lenin Mauricio Turcios Pineda,4757,9
1836178310030170,LaGaceta503,These ads ran without a disclaimer,4732,2
104562788054597,Diego Sánchez,Diego Javier Sánchez Cueva,4723,19
476494152473046,Secretaría de Desarrollo e Inclusión Social.,Carlos Antonio Mendoza Hernandez,4691,19
119582258127974,Nayib Bukele,These ads ran without a disclaimer,4664,5
1947339538818882,Gloria Bonilla Diputada,Erika Rivera,4569,19
139107905951905,SAN Servicio Aeroportuario Nacional,These ads ran without a disclaimer,4566,1
109812834252978,"Para el pueblo, Lo que es del Pueblo. Morazan Yoro",Walter Alejandro Fugon,4545,26
106217518528394,Bilibili Comics home,These ads ran without a disclaimer,4509,6
109560861202119,Politicos de Honduras,These ads ran without a disclaimer,4505,1
997187086980110,David Bustillo,David Bustillo,4479,8
1862418697360011,Omar Emilio Rivera,Victor Rene Canales Suazo,4359,5
109872331350794,Roberto Inestroza,Roberto Inestroza Rivera,4348,8
103124134955244,Teran  Alcalde  La Ceiba  2022-2026,Gerardo Yanes,4283,11
128979450631263,Lissi Matute Cano,These ads ran without a disclaimer,4269,3
1520333004880052,Gráfica Comunicaciones,Héctor Fernando Amador Monjarréz,4237,21
108210934923409,Efrain Tabora Diputado por Copan,Dalila Tabora Urquia,4144,26
103183039368488,Rossel Madrid,Rossel Madrid,4105,32
38414033771,Universidad de San Pedro Sula USAP,These ads ran without a disclaimer,4100,2
1437742899783060,La Panetteria,These ads ran without a disclaimer,4053,2
102572455363148,Tadeo Nodarse Oficial,Johana Sarai Ramirez Maldonado,4048,1
101713739885826,Registro Nacional de las Personas de Honduras,These ads ran without a disclaimer,4042,1
101657971268294,La Oposición de la Oposición,These ads ran without a disclaimer,4009,13
105122242552631,Seguidores de Nayib Bukele en Honduras,Cordelia Ordoñez,4004,1
100893568823719,Emporio El Gran Mayoreo,These ads ran without a disclaimer,4000,11
102503894494718,Juan Carlos Discua,Juan Carlos Discua Maldonado,4000,2
110984171349016,xiomaracastrooficial,These ads ran without a disclaimer,3975,2
110015357810332,Recomienda,These ads ran without a disclaimer,3972,4
106295494634992,Adeliano Amaya,Adeliano Amaya Mendoza,3960,4
103825695591860,Josue Colindres Diputado,Johana Elizabeth Colindres Castellanos,3952,19
107658657801543,Ariel Montoya,Oscar Ariel Montoya Rodezno,3944,22
105376144504505,Ingeniero Ardón Alcalde,These ads ran without a disclaimer,3937,15
323333101198617,Marlon Pineda,Eduardo Enrique Pineda Aguilar,3926,14
347518536497890,Alianza De Los Honestos,Jorge Geovanny Reyes Espinoza,3918,20
107952642129360,Por una Corte Imparcial con Justicia Social,Delmy Saray Caballero Zelaya,3900,6
103955884807125,Yesica Cano,Yesica Lorena Cano Flores,3893,23
100852842563434,1ra Regiduría AMDC 2022-2026 Janina Aguilar,Janina Elizabeth Aguilar Galeas,3886,10
474276366001351,PayPal,These ads ran without a disclaimer,3858,2
105314564991594,Matheu Diputado,José Manuel Matheu Amaya,3800,5
646133215516102,Rony Jonathan Martinez,Rony Jonathan Martinez Chavez,3748,9
34839376970,Infobae,These ads ran without a disclaimer,3725,10
105113255053368,Ana Castro,Ana Mercedes Castro Machado,3718,14
212911527403586,Chelatio Diputado Cortes,Jose David Herrera Chavez,3717,17
107380284559162,Juventud Liberal Nivel Nacional,Josue Daniel Pineda Nuñez,3713,2
112056290212430,La Tribuna,La Tribuna Honduras,3713,3
148067817418722,SPS con Nasralla y Montessi,These ads ran without a disclaimer,3709,3
860018481018485,Apoliticos,These ads ran without a disclaimer,3685,13
292071584499045,Cachurecos,Cachurecos,3666,2
1826135800806136,Marco Tinoco Diputado,Antony Trejo,3597,3
1648326705181400,Jose Oswaldo Ramos Soto,Roger Antonio Rodriguez Gonzalez,3589,5
258480401449628,Rafael Mejia,These ads ran without a disclaimer,3589,6
514959725647003,Fundación para la Libertad Económica,Vicente Oswaldo Vasquez Lavaire,3536,4
110693081275989,La Otra Cara de Latinoamérica,Jorge Alix Mendoza Carcamo,3504,4
1727280190891954,FRANCE 24 Español,These ads ran without a disclaimer,3503,64
105633144515404,El Proselitista HN,Gustavo Adolfo Cruz Rivera,3499,5
606501393156259,Oye Honduras,These ads ran without a disclaimer,3497,17
106682764474082,Woodbridge Academy,These ads ran without a disclaimer,3496,1
1669506560046564,Carlos Zelaya,Guillermo Antonio Zelaya Rosales,3485,6
43880852708,Amnistía Internacional Américas,These ads ran without a disclaimer,3441,1
860432717314171,Chambres de Lavadero,Lincoln Joel Tejada Rosales,3421,3
109459948457740,Gustavo Caceres Diputado,Gustavo Alberto Caceres Banegas,3410,12
607812589389584,Luis Zelaya,Josseline Andrea Garcia Lainez,3386,1
204312453359060,Cesar Gallardo,Cesar Gallardo Rico,3342,7
804997446264798,Chic Me,These ads ran without a disclaimer,3330,1
607812589389584,Luis Zelaya,Omar Edgardo Zelaya,3305,4
106200537675015,Juan Carlos Figueroa,Juan Carlos Figueroa Rojas,3252,20
107892967321266,Radio ODECO 97.1 FM,Naama Sarai Lopez Avila,3249,6
101724988882162,Miguel Caballero Leiva Diputado,Lenin Rigoberto Rodas Velasquez,3200,10
115378890591519,Al Rescate de  la Masica.,Merlo Linares Selvin Eduardo,3196,18
552455591465359,NIMD Honduras,NIMD Honduras,3170,16
110950391250848,PSH -Diputados Francisco Morazan,Adela Zelaya Zavala,3166,6
104642305302577,Leydi Hernández  Regidora Choluteca,Ossmin Isai Euceda Hernandez,3153,13
100583335094005,Ideas.org,Ideas.org,3140,2
108593817936918,Fernando Campo Cornejo,Fernando Manuel Campo Cornejo,3139,13
111762680740571,Altar Mayor,These ads ran without a disclaimer,3133,7
118354179911632,Roberto Contreras,Kelvin Roy Sánchez Ortega,3096,6
104078088131864,Omar Avelar,Omar Avelar Bustillo,3090,10
503951883021764,ShareTheMeal,These ads ran without a disclaimer,3088,30
1666416303574469,Oved Lopez,Oved Lopez,3085,4
2151294911786280,Bartolo Fuentes,Bartolo Antonio Fuentes,3073,6
101359732304206,Share_M113_x2,These ads ran without a disclaimer,3070,6
97320092545,PAHO-WHO,These ads ran without a disclaimer,3028,4
105644348441468,Carlenton Davila,Jose Cárlenton Dávila Mondragon,3020,6
110668294718639,SPS elige,These ads ran without a disclaimer,3020,1
937249039654699,Gabriel Rubi,Jose Maldonado,3006,10
124300620957187,Juan Orlando Hernández,These ads ran without a disclaimer,2999,5
1564609206977999,Ronal Pineda,Ronal Pineda,2970,6
401000470308277,Acción Joven Honduras,Acción Joven Honduras,2964,15
94005676787,Hitachi Vantara,These ads ran without a disclaimer,2952,1
2300269930202821,Gerardo Perez,Gerardo Perez,2944,4
108187281600559,CNE Noticioso,These ads ran without a disclaimer,2937,1
789461611252492,Top Flowers HN,These ads ran without a disclaimer,2925,1
1571186599843722,Favilac Publicidad,These ads ran without a disclaimer,2898,2
167878593236712,UNICEF en español,These ads ran without a disclaimer,2891,15
100111588412670,Abogado Ric Soto HN,Ricardo Soto Castro,2882,28
167878593236712,UNICEF en español,UNICEF,2839,65
