Page ID,Page name,Disclaimer,Amount spent (HNL),Number of ads in Library
268438269939620,Nasry Tito Asfura,Partido Nacional de Honduras,2295196,167
124300620957187,Juan Orlando Hernández,Juan Orlando Hernández,1015079,256
158867210812129,Partido Nacional de Honduras,Partido Nacional de Honduras,985662,51
1392592317738074,Jorge Cálix,Jorge Cálix,880106,394
299920016701445,Xiomara Castro De Zelaya,Partido Libertad y Refundación (LIBRE),673682,47
124300620957187,Juan Orlando Hernández,Presidencia de la República de Honduras,626299,117
283473761746124,David Chávez,Partido Nacional de Honduras,605172,110
980311812004557,Armando Calidonio,Armando Calidonio,504301,145
850142798711511,Ebal Díaz,Ebal Jair Diaz Lupian,382277,1106
633761396813612,Erasmo J. Portillo,Erasmo José Portillo Pinto,358969,56
221798457888029,World Vision Honduras,ASOCIACION VISION MUNDIAL HONDURAS,328656,167
114601521910,Jorge Aldana,Jorge  Aldana,263678,125
703368406666619,Vox Populi HN,Vox Populi HN,215938,92
349524351841734,Cárlenton Dávila,Jose Carlenton Davila Mondragon,203072,46
486382251906084,Honduras El Pais,Diario El  Pais.hn,193729,1571
670215973147907,Osman Aguilar,Osman Danilo Aguilar Ponce,155318,62
104846908122173,Alia Kafati Diputada,Alia Niño Kafaty,152765,247
103731561814112,Oficial Partido Salvador De Honduras,Partido Salvador de Honduras,152741,55
421574011322217,Alcaldía del Distrito Central,Alcaldía del Distrito Central,151610,96
1536298963332674,Eduardo Martell,Eduardo Martell,149093,106
299920016701445,Xiomara Castro De Zelaya,These ads ran without a disclaimer,138842,12
112772801190681,Newsflixx,These ads ran without a disclaimer,123170,12
151154174943498,UNICEF Honduras,These ads ran without a disclaimer,103855,2
167878593236712,UNICEF en español,UNICEF con créditos publicitarios de Facebook,102549,256
1073562932669661,Romeo Vásquez Velásquez,Jesús Alberto Vásquez Zelaya,95146,39
486411318128334,Estamos Listos Honduras,Presidencia de la República de Honduras,94087,60
148653345178694,Casa Presidencial de Honduras,Secretaría de Coordinación General del Gobierno de Honduras,69057,10
249600751823745,Toñito Alcalde SPS,Luis Irwin Leiva Berrios,59522,27
288499014527710,Rasel Tome,Rasel Antonio Tome Flores,57608,44
491553204198958,Revistazo.com,Revistazo.com,55620,125
275244985920774,Antonio Rivera,Antonio Rivera,50517,13
112241373658441,Fernando Gradiz,Fernando Jose Gradiz Benitez,50217,30
140032892460,Embajada de Estados Unidos en Tegucigalpa,These ads ran without a disclaimer,49277,3
338449830056765,Gustavo Romero / Candidato a Diputado por Cortés,Gustavo Adolfo Romero Romero,48831,54
110319032996453,Luis Ortega,Luis Ortega Sanchez,45904,101
213460505776904,Marvin Vásquez Diputado FM Casilla 72,Marvin Reniery Vásquez Teruel,45659,264
107278870906936,GeoMapps Honduras,Geomapps,43596,31
104599735671754,Goberna Honduras,Goberna Honduras,42013,111
1604501296475641,Godofredo Fajardo / Amemos A Nuestra Capital,Godofredo Fajardo Ramirez,41782,48
187581588077191,Juan Barahona,Andres Alfredo Castro Turcios,41250,64
567630230341046,Arturo Alonzo,Felix Arturo Alonzo Matute,40666,57
102923742103397,Cárlenton Dávila,Jose Carlenton Davila Mondragon,39626,33
110168511474333,Distrito News,Distrito News,38892,62
107565870853089,Samuel Garcia,Carlos Armando Garcia Rosales,36645,45
153003381515332,Cespad - Centro de Estudio para la Democracia,Centro de Estudio para la Democracia,36100,46
856012741442139,Ipas LAC,Astrid Leticia Aguilar Pinell,35453,26
109956938157318,Hechos Amanecer,Hechos Amanecer,34313,55
107048651784681,Radio Post,Radio Post,34159,41
1754727451480916,Maribel Espinoza,Adela Zelaya Zavala,33767,41
227061690777961,Televicentro HN,Compañía Televisora S.A.,33031,17
100613059041228,"Gustavo Flores, Alcalde SPS, Casilla #1",Acción Transformadora,32351,147
317590938686910,Oscar Cruz Diputado Suplente,Oscar  Bryan Cruz Almendarez,32336,61
106295494634992,Adeliano Amaya,Hillary Nicole Wong Espinal,31893,19
112333800693678,Hugo Noé Pino Diputado F.M,Daniel Andres Casula Salinas,31494,14
214773008865018,Commission Encounter,These ads ran without a disclaimer,29141,1
106091181352547,Wilmer Rosa,Sergio Murillo,28313,104
112529930493702,Democracia en Acción Hn,Voto Informado Honduras,28276,72
153003381515332,Cespad - Centro de Estudio para la Democracia,Centro de Estudio para la Democracia (Cespad),28083,59
643513979193133,Justicia para Beatriz,Neuma,28043,84
1314458455242369,German Altamirano,Nixon Rufino Castro Cano,27574,18
112226484592571,Diario Post,Diario Post,26526,59
703368406666619,Vox Populi HN,Vox Populi HN,25290,4
699137286926774,Super Liquidaciones HN,Turcios Calix Herson Bladimir,25079,8
102290165456407,Honduras - Vacúnate a Tiempo,These ads ran without a disclaimer,24009,4
1270501863014285,Dr. Walter Perdomo,Walter Perdomo,22380,48
107157760890864,Congreso Primero,Congreso Primero,21592,4
2180582345316242,Secretaría de Desarrollo Social,Secretaria de Estado en el Despacho de Desarrollo Social,21552,11
749945128395059,AHIBA,Asociación Hondureña de Instituciones Bancarias,20936,8
1619479898324505,Partido Liberal de Honduras,Partido Liberal Honduras,20532,6
100616299413033,Soy Chano Rivera,Mario Enrique Rivera Callejas,20422,12
483441215141189,ASJ Honduras,Asociación para una Sociedad más Justa,20349,28
138816232821931,PNUD en Honduras,PNUD (Programa de las Naciones Unidas  para el Desarrollo),20291,14
213736845319886,Carlos Eduardo Reina,Carlos Reina,20163,3
103911988776961,Denis Villalta,Denis Ricardo- Villalta Rivera,20000,4
222259464464471,Yani Rosenthal,Partido Liberal de Honduras,19598,7
106586564537122,Pedro Chávez,MARÍA AUXILIADORA AGUILERA GRANERA,19559,18
143139052987353,Alia Kafati Hay Salida,Alia Niño Kafaty,19384,28
1402511926712969,Mauricio Cálix,Mauricio Calix Ceballos,19359,10
101444895066418,Felicito Avila HN,Vivian Estefane Rodriguez Moncada,19062,23
869306953200646,Fabiola Abudoj,Fabiola Claudett Abudoj Mena,18944,24
221798457888029,World Vision Honduras,World Vision Honduras,18638,6
103112105105138,Juan Carlos Lagos - Diputado por Copán,Juan Carlos Lagos Fuentes,18574,27
187581588077191,Juan Barahona,Darwin Enrique Barahona Najera,18215,10
111283084551923,Allan Macoto Diputado,Mario Merardo Zaldaña Olmedo,17877,47
670215973147907,Osman Aguilar,Osman Aguilar,17731,9
416964031695578,Diputada Scherly Arriaga,Scherly Arriaga,17513,38
109774781441351,Francisco Moran - Diputado Fco. Morazán,Jorge Geovanny Reyes Espinoza,17124,32
101779245131396,Maria Antonieta Mejia,Waleskita Mejia,17073,6
103978381957546,Catracho Macizo,Martha Sobeida Soto Lezama,16629,41
110503794626548,"Laboratorio de Gobierno, Innovación y Políticas Públicas - LIBRE",These ads ran without a disclaimer,16520,1
101156194954745,Andres Castro,Andres Alfredo Castro Turcios,16465,39
100750711782346,Christian Martinez Diputado,Christian Josue Martinez Acosta,16276,45
130202453827085,Asociacion Calidad de Vida,Asociación Calidad de Vida,16203,20
237087153044234,Renan Inestroza,Rossel Renan Inestroza Martinez,16170,20
1619479898324505,Partido Liberal de Honduras,Partido Liberal de Honduras,15586,29
106862948409248,Unificación Democrática,Lenin Rigoberto Rodas Velasquez,15582,21
1466489633376036,Gilberto Yearwood,Gilberto Jeronimo Yearwood,15563,5
107756271125002,Omar Menjivar,Dania Lizbeth Paz Pacheco,14503,18
112333800693678,Hugo Noé Pino Diputado F.M,Allan Policarpo Mendez Padilla,14486,18
114301125304932,Secretaría de Trabajo y Seguridad Social,These ads ran without a disclaimer,14407,10
101419972288825,Ernesto Pumpo Diputado casilla #123 cortes,Ernesto Alfonso Pumpo Aguilar,14157,26
21325533991,Inversor Global,These ads ran without a disclaimer,13965,12
112333800693678,Hugo Noé Pino Diputado F.M,René Efrain Arias Lopez,13900,15
286652458359644,Mario Suazo,Mario Orlando Suazo Lara,13730,26
110693081275989,La Otra Cara de Latinoamérica,Ana Margarita Lopez Cerrato,13668,28
101704425334880,Erik Javier Tabora,Erik Javier Tabora Tabora,13400,32
28312410177,World Food Programme,These ads ran without a disclaimer,13322,131
268438269939620,Nasry Tito Asfura,These ads ran without a disclaimer,13291,12
109091011430956,Ultra Fighter: Supernova,These ads ran without a disclaimer,12916,14
112724021787834,Por Nuestros Hijos,Con Mis Hijos No Te Metas HN,12865,35
109580408013707,Francisco Flores,Francisco Miguel Flores Guifarro,12658,54
103459952166807,Nota Pública,Nota Pública,12346,15
100230499051562,Dr. José Jaar Diputado,Salvador Jesús García Aguilar,12315,1
1293887574037684,Harry Panting Diputado,Harry Stephen Panting Zelaya,12238,4
107640905023095,Martín Pineda Diputado,Agencia de medios digitales nueve de diez,12069,8
816762251805920,Secretaria de Asuntos Electorales PSH,William Eduardo Carias Ortega,12023,31
100132868614625,Javier Santos,Stephanie Bueso De Santos,11891,6
209099099549632,Luis Rene Suazo,Luis Rene Suazo Peña,11783,5
1314458455242369,German Altamirano,German Altamirano,11689,51
103403128354133,Guillermo Bográn,Despacho de Guillermo y el Pueblo,11656,14
1511642142221183,Deisy Banegas Diputada,Deysi Rosibel Banegas Espinal,11647,15
919092984894463,Partido Salvador de Honduras,Cordelia Ordoñez,11636,5
111168057292933,Universal Noticias,Felecity Celene Cooper Cooper,11573,12
106668254944240,Diputado Leiva,Jacobo Enrique Sanchez Matute,11416,38
496839213786593,"Secretaría Nacional de Ciencia, Tecnología e Innovación",SENACIT,11285,43
103130098432214,El Desmadrado,These ads ran without a disclaimer,11259,11
108562711599066,Eliseo Vallecillo Alcalde SPS Casilla6,Eliseo Vallecillo Reyes,11093,11
101186198642252,Wendy Guerra Alcaldesa,Erik Javier Tabora Tabora,10757,23
279672622673974,Que alguien me explique,These ads ran without a disclaimer,10641,22
112512804005980,Inversiones B&T,Kizzy Stephany Bermudez Najera,10532,10
1519747768323108,Edil Mendez,Edil Mendez,10315,25
127750160666287,Tommy Zambrano Diputado,Cristian Edgardo Moreno Funes,10180,8
209729959619098,Luis Pinel,Luis Pinel,10124,11
58895017663,Banco Interamericano de Desarrollo,These ads ran without a disclaimer,10055,39
101686915153735,Angela Fernández,Julio Cesar Peña Montoya,9994,24
101047364836155,Lidia Lopez,Lidia Maria Lopez Amador,9899,18
459107311130639,Dr. Luther Harry,Dr. Luther Harry,9883,67
316667995124531,Banco Centroamericano de Integración Económica - BCIE,Banco Centroamericano de Integración Económica,9828,9
850142798711511,Ebal Díaz,These ads ran without a disclaimer,9803,31
114601521910,Jorge Aldana,These ads ran without a disclaimer,9562,17
103191245342461,Liberales Yoro II,Liberales Yoro,9523,20
108670680800309,Ever Miguel Velasquez,Fernando Navarro Hernandez,9368,4
1265830616816937,Linda Donaire,Linda Frances Donaire Portillo,9237,61
241818544421013,Liliana Guevara Diputada / Yoro,Juan Antonio Discua Castro,9182,34
103187835005303,Ramón Enrique Barrios,Maria Isabel Valdez Briones,9120,11
576932955838386,Iris Pineda,Iris Pineda Ramírez,9065,3
544097135969884,Kritza Pérez,Kritza Jerlin Pérez Gallegos,8850,9
108854322177699,Titanes de la Niñez,Con Mis Hijos No Te Metas HN,8844,22
885680998238121,Melvin Paredes,Hector Manuel Sandoval Rodriguez,8801,15
102366311693428,Made Pedraza Diputada #151,Madelein Pedraza Budde,8685,27
100983801732465,Arlinton López,Arlinton Lopez,8620,16
104340444603882,Ayudas matres soltera,These ads ran without a disclaimer,8445,2
213736845319886,Carlos Eduardo Reina,These ads ran without a disclaimer,8231,5
919092984894463,Partido Salvador de Honduras,William Eduardo Carias Ortega,8223,19
103953654913558,Carolina  Fernandez Trochez,Lourdes Carolina Fernandez Trochez,8210,14
110142624101962,Nelson Márquez,Johann Serén Castillo,8170,26
248986568895243,Speechify,These ads ran without a disclaimer,8131,9
1484915738427517,Iroshka Elvir de Nasralla,Iroshka Lindaly Elvir Nasralla,8109,17
101188568427152,Fardos Nashly Montecinos,These ads ran without a disclaimer,7999,4
1047750315359377,Tato Loucel,Edgardo  Hernan Loucel Aguilera,7924,27
105397322360821,Red LGBTIQ+ Chamelecón,Miguel Eduardo Barahona Castro,7876,8
122988594435371,Instituto Forymat,These ads ran without a disclaimer,7831,2
104930718595058,Hilmer Hermida,Johana Sarai Ramirez Maldonado,7828,8
582482678625013,Asley  Cruz,Asley Guillermo Cruz Mejia,7779,8
68793499001,UNICEF,UNICEF with Facebook Ad Credits,7667,352
104111364355253,Diario Paradigma,Joan Marcelo,7637,16
699137286926774,Super Liquidaciones HN,Fernando Navarro Hernandez,7549,1
110307101473418,Rescatemos el Congreso Nacional de Honduras,Jorge Geovanny Reyes Espinoza,7422,18
147751821930575,Salud Digital Fundación Carlos Slim,These ads ran without a disclaimer,7398,4
231951286852691,Gilberto Ríos Munguía - Grillo,Gilberto Rios Munguia,7120,11
101226852237939,Centroamérica Post,Martha Sobeida Soto Lezama,7080,6
739334302924225,Ronald Panchame,Luis Alberto Zepeda Argueta,7047,50
106586564537122,Pedro Chávez,María Auxiliadora Aguilera Granera,7000,18
107166437591846,Fausto Cálix HN,Fausto Manuel Calix Marquez,7000,21
103366818771274,Ana Burgos Diputada 301,Ana Carola Burgos Lopez,6994,4
102200678953147,Wilfredo Lopez Casilla 174,Hector Manuel Sandoval Rodriguez,6900,8
107029964338157,Mario Argeñal,Mario Rafel Argeñal Medina,6900,16
114154619999514,Partido Naranja de Honduras,Raul Peña Moreno,6890,16
709160849247917,Evis Santos,Evis Alexander Santos Tabora,6738,34
607812589389584,Luis Zelaya,These ads ran without a disclaimer,6498,4
118795083320932,Tavo Rodas,Jose Octavio Rodas Mendoza,6478,14
1835111130104087,Victor Barahona Diputado Comayagua,Stevens Barahona,6399,12
1342879305770317,Allan Salazar Diputado,Allan Gerardo Salazar Funes,6274,25
359326941305683,Franklin Avila,Franklin Alonso Avila Carrasco,6133,24
102609935176471,Carla Dip Diputada,Carla Belinda Dip Alvarado,6100,2
101775188874514,Dra Paola Carbajal,Gaby Paola Carbajal Matute,6059,10
339810463063059,Conflict Of Nations : World War 3,These ads ran without a disclaimer,6043,87
486411318128334,Estamos Listos Honduras,These ads ran without a disclaimer,6038,25
113632726761769,Gobierno Honduras,Presidencia de la República de Honduras,6000,3
351987848323268,Visita Sorpresa,Secretaría de Coordinación General del Gobierno de Honduras,5920,2
103978381957546,Catracho Macizo,These ads ran without a disclaimer,5920,4
104756201617166,MP CLEAN HN,These ads ran without a disclaimer,5876,14
881938578596076,Cristianos Valientes,Cristianos Valientes,5775,4
100864608419889,Realidad Política,These ads ran without a disclaimer,5682,13
1536298963332674,Eduardo Martell,Vika Yovanka Martell Castro,5647,10
973656702704928,ParadigmaEncuestadora,Fredy Ordoñez Flores,5618,4
348016209601920,Salvador Mata Alcalde,Alexander Martinez,5545,47
415068788604369,David Reyes   Diputado  por Choluteca,David Reyes,5514,16
1716073355341256,La Visión,La Vision,5500,2
102503894494718,Juan Carlos Discua,Jimmy Jhonatan Discua Maldonado,5402,4
1073562932669661,Romeo Vásquez Velásquez,Marvin Reniery Vásquez Teruel,5400,3
107045680721133,La Alianza con el Pueblo,These ads ran without a disclaimer,5320,9
103031135787229,Sensus,Sensus,5307,42
319749898114045,Jackpot Party Casino Community,These ads ran without a disclaimer,5278,3
476494152473046,Secretaría de Desarrollo e Inclusión Social.,These ads ran without a disclaimer,5221,9
1797637890483746,Edwin Guifarro,Alex Manuel Lara Rodriguez,5212,11
1536298963332674,Eduardo Martell,These ads ran without a disclaimer,5183,22
104380401971066,Molly Rubi Diputada,Emelda Mollylu Rubi Canizales,5135,20
107928668693500,"Quintin Soriano ""La Leyenda""",Noel Aristeo Molina Funes,5076,32
724521631682438,Honduras News,Honduras News,5061,6
202788706997599,Whirlpool,These ads ran without a disclaimer,5059,1
1392592317738074,Jorge Cálix,These ads ran without a disclaimer,5043,14
803587436436553,OCDIH,Lilian Guadalupe Gomez Dominguez,5042,12
269871094826846,Javier Matute - Alcalde,Francisco Javier Matute Romero,4999,5
104724984609378,Laura Enamorado,Laura Enamorado,4983,23
1899303030316889,"Rina Mancía, Casilla 23",Rina Mancía,4834,3
114100139971983,Alejandro Matute Diputado,Eliana Grizeth Salinas Lopez,4830,12
101731461809193,El Periódico de Honduras,Jensy Ninett Reyes Mejia,4799,12
170390491747320,Lenin Turcios - Diputado PINU SD,Lenin Mauricio Turcios Pineda,4734,9
1836178310030170,LaGaceta503,These ads ran without a disclaimer,4704,2
104562788054597,Diego Sánchez,Diego Javier Sánchez Cueva,4704,19
476494152473046,Secretaría de Desarrollo e Inclusión Social.,Carlos Antonio Mendoza Hernandez,4691,19
119582258127974,Nayib Bukele,These ads ran without a disclaimer,4641,5
1947339538818882,Gloria Bonilla Diputada,Erika Rivera,4569,19
109812834252978,"Para el pueblo, Lo que es del Pueblo. Morazan Yoro",Walter Alejandro Fugon,4545,26
109560861202119,Politicos de Honduras,These ads ran without a disclaimer,4487,1
106217518528394,Bilibili Comics home,These ads ran without a disclaimer,4487,6
997187086980110,David Bustillo,David Bustillo,4479,8
1862418697360011,Omar Emilio Rivera,Victor Rene Canales Suazo,4359,5
110882925332549,Yani Rosenthal,Yani Benjamin Rosenthal Hidalgo,4358,4
109872331350794,Roberto Inestroza,Roberto Inestroza Rivera,4335,8
103124134955244,Teran  Alcalde  La Ceiba  2022-2026,Gerardo Yanes,4283,11
128979450631263,Lissi Matute Cano,These ads ran without a disclaimer,4269,3
1520333004880052,Gráfica Comunicaciones,Héctor Fernando Amador Monjarréz,4237,21
108210934923409,Efrain Tabora Diputado por Copan,Dalila Tabora Urquia,4124,26
1437742899783060,La Panetteria,These ads ran without a disclaimer,4053,2
102572455363148,Tadeo Nodarse Oficial,Johana Sarai Ramirez Maldonado,4048,1
101713739885826,Registro Nacional de las Personas de Honduras,These ads ran without a disclaimer,4042,1
105122242552631,Seguidores de Nayib Bukele en Honduras,Cordelia Ordoñez,4004,1
100893568823719,Emporio El Gran Mayoreo,These ads ran without a disclaimer,4000,11
102503894494718,Juan Carlos Discua,Juan Carlos Discua Maldonado,4000,2
101657971268294,La Oposición de la Oposición,These ads ran without a disclaimer,3989,13
110015357810332,Recomienda,These ads ran without a disclaimer,3972,4
110984171349016,xiomaracastrooficial,These ads ran without a disclaimer,3956,2
107658657801543,Ariel Montoya,Oscar Ariel Montoya Rodezno,3944,22
106295494634992,Adeliano Amaya,Adeliano Amaya Mendoza,3941,4
323333101198617,Marlon Pineda,Eduardo Enrique Pineda Aguilar,3926,14
347518536497890,Alianza De Los Honestos,Jorge Geovanny Reyes Espinoza,3921,20
107952642129360,Por una Corte Imparcial con Justicia Social,Delmy Saray Caballero Zelaya,3900,6
103955884807125,Yesica Cano,Yesica Lorena Cano Flores,3893,23
100852842563434,1ra Regiduría AMDC 2022-2026 Janina Aguilar,Janina Elizabeth Aguilar Galeas,3867,10
474276366001351,PayPal,These ads ran without a disclaimer,3839,2
105314564991594,Matheu Diputado,José Manuel Matheu Amaya,3800,5
646133215516102,Rony Jonathan Martinez,Rony Jonathan Martinez Chavez,3748,9
148067817418722,SPS con Nasralla y Montessi,These ads ran without a disclaimer,3745,3
34839376970,Infobae,These ads ran without a disclaimer,3707,10
105113255053368,Ing. Ana Castro Alcaldesa,Ana Mercedes Castro Machado,3703,14
103825695591860,Josue Colindres Diputado,Johana Elizabeth Colindres Castellanos,3702,18
212911527403586,Chelatio Diputado Cortes,Jose David Herrera Chavez,3699,17
107380284559162,Juventud Liberal Nivel Nacional,Josue Daniel Pineda Nuñez,3695,2
112056290212430,La Tribuna,La Tribuna Honduras,3695,3
860018481018485,Apoliticos,These ads ran without a disclaimer,3667,13
101516212181501,AIO Browser,These ads ran without a disclaimer,3606,7
1826135800806136,Marco Tinoco Diputado,Antony Trejo,3597,3
1727280190891954,FRANCE 24 Español,These ads ran without a disclaimer,3594,64
1648326705181400,Jose Oswaldo Ramos Soto,Roger Antonio Rodriguez Gonzalez,3589,5
258480401449628,Rafael Mejia,These ads ran without a disclaimer,3572,6
270163195179,Cable Color,These ads ran without a disclaimer,3547,7
514959725647003,Fundación para la Libertad Económica,Vicente Oswaldo Vasquez Lavaire,3536,4
110693081275989,La Otra Cara de Latinoamérica,Jorge Alix Mendoza Carcamo,3504,4
105633144515404,El Proselitista HN,Gustavo Adolfo Cruz Rivera,3499,5
606501393156259,Oye Honduras,These ads ran without a disclaimer,3497,17
1669506560046564,Carlos Zelaya,Guillermo Antonio Zelaya Rosales,3485,6
106682764474082,Woodbridge-hs,These ads ran without a disclaimer,3478,1
860432717314171,Chambres de Lavadero,Lincoln Joel Tejada Rosales,3419,3
607812589389584,Luis Zelaya,Josseline Andrea Garcia Lainez,3386,1
105376144504505,Ingeniero Ardón Alcalde,These ads ran without a disclaimer,3345,14
204312453359060,Cesar Gallardo,Cesar Gallardo Rico,3325,7
804997446264798,Chic Me,These ads ran without a disclaimer,3314,1
607812589389584,Luis Zelaya,Omar Edgardo Zelaya,3305,4
106200537675015,Juan Carlos Figueroa,Juan Carlos Figueroa Rojas,3252,20
109459948457740,Gustavo Caceres Diputado,Gustavo Alberto Caceres Banegas,3251,12
107892967321266,Radio ODECO 97.1 FM,Naama Sarai Lopez Avila,3249,6
101724988882162,Miguel Caballero Leiva Diputado,Lenin Rigoberto Rodas Velasquez,3200,10
115378890591519,Al Rescate de  la Masica.,Merlo Linares Selvin Eduardo,3196,18
503951883021764,ShareTheMeal,These ads ran without a disclaimer,3170,31
552455591465359,NIMD Honduras,NIMD Honduras,3170,16
110950391250848,PSH -Diputados Francisco Morazan,Adela Zelaya Zavala,3166,6
111762680740571,Altar Mayor,These ads ran without a disclaimer,3164,7
104642305302577,Leydi Hernández  Regidora Choluteca,Ossmin Isai Euceda Hernandez,3153,13
108593817936918,Fernando Campo Cornejo,Fernando Manuel Campo Cornejo,3139,13
118354179911632,Roberto Contreras-Alcalde,Kelvin Roy Sánchez Ortega,3096,6
104078088131864,Omar Avelar,Omar Avelar Bustillo,3090,10
1666416303574469,Oved Lopez,Oved Lopez,3078,4
2151294911786280,Bartolo Fuentes,Bartolo Antonio Fuentes,3073,6
101359732304206,Share_M113_x2,These ads ran without a disclaimer,3055,6
105644348441468,Carlenton Davila,Jose Cárlenton Dávila Mondragon,3020,6
97320092545,PAHO-WHO,These ads ran without a disclaimer,3013,4
937249039654699,Gabriel Rubi,Jose Maldonado,3006,10
110668294718639,SPS elige,These ads ran without a disclaimer,3005,1
124300620957187,Juan Orlando Hernández,These ads ran without a disclaimer,2999,5
401000470308277,Acción Joven Honduras,Acción Joven Honduras,2964,15
447476848762504,Fondo Cafetero Nacional,Fondo Cafetero Nacional,2956,4
94005676787,Hitachi Vantara,These ads ran without a disclaimer,2937,1
789461611252492,Top Flowers HN,These ads ran without a disclaimer,2925,1
108187281600559,CNE Noticioso,These ads ran without a disclaimer,2923,1
1571186599843722,Favilac Publicidad,These ads ran without a disclaimer,2898,2
100111588412670,Abogado Ric Soto HN,Ricardo Soto Castro,2882,28
496839213786593,"Secretaría Nacional de Ciencia, Tecnología e Innovación","Secretaría Nacional de Ciencia, Tecnología e Innovación",2861,20
159502307523717,Somos- CDC,Naama Sarai Lopez Avila,2834,5
167878593236712,UNICEF en español,UNICEF,2825,65
178733982198928,SulaTech Noticias,Carlos Alberto Reyes Hernandez,2759,16
140441793233304,Cooking Madness - A Chef's Game Community,These ads ran without a disclaimer,2755,1
105893965084187,Gilliany Alcaldesa Juticalpa,Gilliany Sandoval Gomez,2736,30
109350340947036,Santiago Sabillón Madrid,Merlyn Jonathan Madrid Martínez,2735,13
131793653512148,Diario La Prensa,These ads ran without a disclaimer,2726,3
104933295285597,Gerson Gomez DP,These ads ran without a disclaimer,2710,8
180779708635647,Juan Diego Zelaya,These ads ran without a disclaimer,2709,15
113567163834886,Fito Diputado,pinu sd,2671,9
338793716876747,Conversando con,Noel Aristeo Molina Funes,2661,22
102785378571757,El Ladron,These ads ran without a disclaimer,2654,2
107381814920756,Ruth Medina 161,Ruth Medina,2646,11
156212587844635,Scarleth Romero - Copán,Scarleth Romero,2633,19
739944189470248,Samir  Molina,These ads ran without a disclaimer,2627,6
105036179534606,"Gildan, Making Apparel Better",These ads ran without a disclaimer,2620,20
106725177898260,"Marvin Perdomo Alcalde de El Progreso, Yoro",Baudilio Barahona Trochez,2590,8
101215954716158,Acción Democrática Hondureña,Mirelle Xiomara Fontecha Sandoval,2590,5
650190421770978,Portafolio / Agencia de publicidad,These ads ran without a disclaimer,2568,4
110693081275989,La Otra Cara de Latinoamérica,Felecity Celene Cooper Cooper,2542,3
409913119054230,Alcalde Gerardo Quijada,These ads ran without a disclaimer,2524,9
100818338693217,Denis Rivera,Rafa Martinez,2520,5
152914224736727,Banco Mundial,These ads ran without a disclaimer,2489,245
108611045139954,Mesa de Cambio Climático HN,Miguel Eduardo Barahona Castro,2474,5
107785887384399,Puro Show,Russel Jensen Garay Bautista,2463,1
116582965035592,CHILI'S HONDURAS,These ads ran without a disclaimer,2463,2
973656702704928,ParadigmaEncuestadora,Joan Marcelo Ordoñez Figueroa,2462,1
1497502300316673,Jeff Mosil - Negocios De Elite,These ads ran without a disclaimer,2430,2
104304692067590,Jorge Aldana Alcalde - Cárlenton Dávila Vice Alcalde,Jorge Geovanny Reyes Espinoza,2411,6
108998514609698,Transparencia Municipal 1503,These ads ran without a disclaimer,2388,19
187581588077191,Juan Barahona,These ads ran without a disclaimer,2384,16
1545555582174942,TResearch,These ads ran without a disclaimer,2383,4
326595052087144,Observatorio Democrático Juventud Honduras,Gabriela Liliana Blen Hernandez,2353,27
973656702704928,ParadigmaEncuestadora,Joan Marcelo,2335,5
1828470140727109,Alto Comisionado de la ONU para los Derechos Humanos en Honduras,These ads ran without a disclaimer,2302,3
284544973391295,Samuel Aguilera,Samuel Armando Aguilera Aguilar,2294,9
336126847060433,Paty Figueroa,Juan Enrique Navarro,2267,7
179844448722977,Valle de Ángeles Libre,Henry Daniel Ponce Rodriguez,2200,12
1735128200075724,Somos Muchas,Somos Muchas,2199,3
